Tax Type,2020 Budget,July 2020 YTD Actual,2019 Budget,July 2019 YTD Actual
"Property Taxes – all funds (Levied, TIF and Other)","21,863,722","8,007,048","20,963,036","7,885,327"
"Utility User Fees (Water, WPC, Storm Water, and Sanitation Funds)","22,727,595","12,990,496","22,558,411","13,511,359"
"Sales Tax – all types (Home Rule, State Sales Tax, Business Districts)","17,606,535","9,870,760","17,440,961","9,917,851"
"Public Safety – all funds (Police, Fire, Traffic Signals, Inspections)","32,974,940","17,295,978","32,651,763","16,595,462"
"Utility Expenses – all funds (Water, WPC, Storm Water and Sanitation Funds)","27,356,105","12,965,899","23,844,973","12,989,375"
Capital Improvements – all funds (Capital Projects and Capital Equipment),"10,996,840","6,186,953","7,209,169","3,619,885"
